character,role,canonical_file,duplicate_files,goal,lie,truth,flaw,strength,arc_type,mannerism,intro_rest_ch,vulnerability_ch,lie_test_ch,lie_fails_ch,resolution_ch,completeness_pct,notes
Aisen Korv,Protagonist,manuscript/characters/main/aisen-korv.md,,Preserve Aisen's network so others can carry it forward,Ordinary people cannot change systems,Synthesis of all approaches creates new possibility,Tries to carry everything alone,Pattern recognition; synthesis thinking,Sacrifice arc,Observes before speaking; perpetual calculation at rest,Ch 1,Ch 8 (financial crisis),Ch 22B (hearing — drafted),Ch 43 (death),Ch 43-45 (network carries on),90,Death + legacy chapters need MU accounting; Ch 22B now drafted
Kael,Ally / Field operative,manuscript/characters/allies/kael-profile.md,,"Keep the network alive, protect people in it",Field pragmatism means you can hold grief off indefinitely,Cost of suppression accumulates until the person breaks,Suppresses grief as method; doesn't grieve publicly,Tactical intelligence; long-game patience,Hardening arc,Quiet; counts things; physically still under pressure,Ch 14B (culvert),Ch 26B (village aftermath — drafted),Ch 26B,Ch 50 (breakdown moment TBD),Ch 55B,70,Ch 26B now drafted; breakdown moment in Ch 50 not yet drafted
Vex,Ally / Engineer,manuscript/characters/VEX-PROFILE-EXPANDED.md,manuscript/characters/allies/thalassa-mirrorrow.md,"Document everything accurately, let the record speak","Neutral observation is safe — involvement is dangerous","Observation without action is complicity",Stays behind documentation; never directly acts,Structural precision; finds hidden patterns,Transformation arc,Taps surfaces to hear what they say; takes measured pauses,Ch 17B (survey),Ch 17B (Perren arrest),Ch 36B (survey used as intel),Ch 39B (tbd),Ch 68B,60,Ch 36B and 39B not yet written; canonical file needs updating (currently mapped to wrong file)
Amara,Ally / Military officer,manuscript/characters/allies/amara-okafor.md,,"Ensure military decisions account for human cost","Filing the correct report is sufficient action","Correct reports require follow-through enforcement",Trusts institutional process past the point it has earned that trust,Moral clarity; physical courage; documentation discipline,Gradual radicalization arc,Restates numbers precisely; asks "how many" with deliberate bluntness,Ch 19B (desk scene),Ch 19B (deployment hold),Ch 29B (blockade — drafted),Ch 50 (tbd),Ch 55,75,Ch 29B now drafted; Ch 50 not yet drafted
Serath,Ally / Military commander,manuscript/characters/TIER-SECONDARY/SERATH-profile.md,manuscript/characters/SERATH-PROFILE-EXPANDED.md,"Win the battle that matters; protect your people","Military discipline is the same as moral clarity","Discipline is a tool, not a value",Follows orders past the point of valid command authority,Tactical brilliance; loyalty to soldiers,Crisis-of-command arc,Field notes in margins; counts exits on entering any room,Ch 30-ish (tbd),Ch 45 (first contact non-report),Ch 55-ish,Ch 65 (tbd),Ch 75 (tbd),40,Serath canonical file needs to be confirmed — currently mapped approximately; many scenes outline-only
Rin Celestara,Ally / Intelligence operative,manuscript/characters/TIER-SECONDARY/RIN-CELESTARA-profile.md,manuscript/characters/allies/RIN-SHIRAKAWA.md,"Keep the network intact by staying anonymous","Being unknown keeps people safe","Selective silence harms people in the same way active betrayal does",Withholds information to protect method; lets others bear costs of her silence,Pattern recognition; information architecture; operational patience,Revelation arc (forced transparency),Touches left glove lining (where she stores things); no wasted movement,Ch 21B (archive),Ch 21B (student removed),Ch 34B (Ghost revealed tbd),Ch 62 (tbd),Ch 84 (writes the history),55,Ch 34B not yet written; revelation mechanics not yet fully plotted
Kaelen Blackwood,Ally / Synthesis mage,manuscript/characters/allies/kaelen-blackwood.md,,"Heal the land and the people on it without destroying either","Refusing harm means never cutting what needs to be cut","Choosing not to act is also a choice with consequences",Pacifist refusal past the point where it becomes structural complicity,Patience; synthesis thinking; genuine ecological knowledge,Sacrifice-of-principle arc,Three knocks on surface before beginning; humming the listening tone,Ch 15B (greenhouse),Ch 15B (glass-blight refusal),Ch 44B (tbd),Ch 66 (tbd),Ch 79 (years of sacrifice),75,Ch 44B not yet written; good intro in 15B; note: canonical name is Kaelen Blackwood not Thornwood
Elara Valorin,Ally / Princess / Political leader,manuscript/characters/allies/elara-valorin.md,,"Create systems that do not require individuals to sacrifice themselves to work","Privilege plus skill equals right to act unilaterally","Privilege plus skill equals responsibility to build structures that outlast individuals",Uses individual capability as substitute for building institutions,Analytical precision; diplomatic range; dual-identity management,Leadership maturation arc,Touches crescent scar on left shoulder as calibration; arrives first,Ch 20B (court breakfast),Ch 20B (post-warning isolation),Ch 33B (ultimatum letter — drafted),Ch 61 (negotiation session tbd),Ch 76 (post-war governance),80,Ch 33B and 47B now drafted; Ch 48B and 61 not yet written; Arc C scene map exists
